{
  "artifact_type": "aic_behavior_observation_set",
  "contract_id": "checkout.complete.behavior",
  "generated_at": "2026-09-02T21:58:27.948Z",
  "observations": [
    {
      "artifact_type": "aic_behavior_observation",
      "captured_at": "2026-09-02T21:58:27.948Z",
      "contract_id": "checkout.complete.behavior",
      "duration_ms": 1064,
      "environment": {
        "adapter": "@aicorg/evidence-playwright",
        "argument_encoding": "not_applicable",
        "browser": "Google Chrome",
        "browser_version": "152.0.7977.75",
        "feature_mode": "testing_flag",
        "native_webmcp": "false",
        "surface": "human-ui",
        "tool_result_type": "none",
        "webmcp_api": "not_applicable"
      },
      "evidence": [
        {
          "digest": "sha256:99662c3590b2b5086afdee3458ded802439b831b7d2de230a5ef6654b673cd7d",
          "kind": "screenshot",
          "ref": "aic-browser-evidence/success--human-ui.png"
        }
      ],
      "mode": "executed",
      "operation_id": "checkout.complete.domain",
      "surface_id": "human-ui",
      "checks": [
        {
          "actual": "draft",
          "passed": true,
          "requirement_id": "order.is_draft"
        },
        {
          "actual": {
            "order_id": "ord_100245",
            "order_total": "$177.00",
            "payment_method": "Visa ending 4242"
          },
          "passed": true,
          "requirement_id": "checkout.exact_scope"
        },
        {
          "actual": "accepted",
          "passed": true,
          "requirement_id": "authorization.allowed"
        },
        {
          "actual": "accepted",
          "passed": true,
          "requirement_id": "confirmation.accepted"
        },
        {
          "actual": {
            "attempt_count": 1,
            "audit_count": 1,
            "charge_count": 1
          },
          "passed": true,
          "requirement_id": "payment.idempotent"
        },
        {
          "actual": 1,
          "passed": true,
          "requirement_id": "payment.charge"
        },
        {
          "actual": "submitted",
          "passed": true,
          "requirement_id": "order.submitted"
        },
        {
          "actual": "charged",
          "passed": true,
          "requirement_id": "payment.charged"
        },
        {
          "actual": 1,
          "passed": true,
          "requirement_id": "checkout.audit_recorded"
        },
        {
          "actual": "",
          "passed": false,
          "requirement_id": "authorization.denied"
        },
        {
          "actual": "accepted",
          "passed": false,
          "requirement_id": "confirmation.declined"
        },
        {
          "actual": "",
          "passed": false,
          "requirement_id": "execution.failure_isolated"
        },
        {
          "actual": {
            "order_id": "ord_100245",
            "order_status": "submitted",
            "payment_status": "charged"
          },
          "passed": false,
          "requirement_id": "order.unchanged"
        },
        {
          "actual": false,
          "passed": false,
          "requirement_id": "checkout.safe_recovery"
        }
      ],
      "confirmation": "accepted",
      "outcome": {
        "order_id": "ord_100245",
        "order_status": "submitted",
        "payment_status": "charged"
      },
      "scenario_id": "success",
      "status": "succeeded"
    },
    {
      "artifact_type": "aic_behavior_observation",
      "captured_at": "2026-09-02T21:58:27.948Z",
      "contract_id": "checkout.complete.behavior",
      "duration_ms": 1007,
      "environment": {
        "adapter": "@aicorg/evidence-playwright",
        "argument_encoding": "json_string_compat",
        "browser": "Google Chrome",
        "browser_version": "152.0.7977.75",
        "feature_mode": "testing_flag",
        "native_webmcp": "true",
        "surface": "webmcp",
        "tool_result_type": "object",
        "webmcp_api": "document.modelContext"
      },
      "evidence": [
        {
          "digest": "sha256:ad33a054e12a7f0728fff800076dc7f973df810c2564b390f0a0e90d2aeb226c",
          "kind": "screenshot",
          "ref": "aic-browser-evidence/success--webmcp.png"
        }
      ],
      "mode": "executed",
      "operation_id": "checkout.complete.domain",
      "surface_id": "webmcp",
      "checks": [
        {
          "actual": "draft",
          "passed": true,
          "requirement_id": "order.is_draft"
        },
        {
          "actual": {
            "order_id": "ord_100245",
            "order_total": "$177.00",
            "payment_method": "Visa ending 4242"
          },
          "passed": true,
          "requirement_id": "checkout.exact_scope"
        },
        {
          "actual": "accepted",
          "passed": true,
          "requirement_id": "authorization.allowed"
        },
        {
          "actual": "accepted",
          "passed": true,
          "requirement_id": "confirmation.accepted"
        },
        {
          "actual": {
            "attempt_count": 1,
            "audit_count": 1,
            "charge_count": 1
          },
          "passed": true,
          "requirement_id": "payment.idempotent"
        },
        {
          "actual": 1,
          "passed": true,
          "requirement_id": "payment.charge"
        },
        {
          "actual": "submitted",
          "passed": true,
          "requirement_id": "order.submitted"
        },
        {
          "actual": "charged",
          "passed": true,
          "requirement_id": "payment.charged"
        },
        {
          "actual": 1,
          "passed": true,
          "requirement_id": "checkout.audit_recorded"
        },
        {
          "actual": "",
          "passed": false,
          "requirement_id": "authorization.denied"
        },
        {
          "actual": "accepted",
          "passed": false,
          "requirement_id": "confirmation.declined"
        },
        {
          "actual": "",
          "passed": false,
          "requirement_id": "execution.failure_isolated"
        },
        {
          "actual": {
            "order_id": "ord_100245",
            "order_status": "submitted",
            "payment_status": "charged"
          },
          "passed": false,
          "requirement_id": "order.unchanged"
        },
        {
          "actual": false,
          "passed": false,
          "requirement_id": "checkout.safe_recovery"
        }
      ],
      "confirmation": "accepted",
      "outcome": {
        "order_id": "ord_100245",
        "order_status": "submitted",
        "payment_status": "charged"
      },
      "scenario_id": "success",
      "status": "succeeded"
    },
    {
      "artifact_type": "aic_behavior_observation",
      "captured_at": "2026-09-02T21:58:27.948Z",
      "contract_id": "checkout.complete.behavior",
      "duration_ms": 1035,
      "environment": {
        "adapter": "@aicorg/evidence-playwright",
        "argument_encoding": "not_applicable",
        "browser": "Google Chrome",
        "browser_version": "152.0.7977.75",
        "feature_mode": "testing_flag",
        "native_webmcp": "false",
        "surface": "human-ui",
        "tool_result_type": "none",
        "webmcp_api": "not_applicable"
      },
      "evidence": [
        {
          "digest": "sha256:4bb543d4ccdf4cdd9231c4a0745a4c35b6d4fb701584f2ea24e424183d2f065c",
          "kind": "screenshot",
          "ref": "aic-browser-evidence/authorization-denied--human-ui.png"
        }
      ],
      "mode": "executed",
      "operation_id": "checkout.complete.domain",
      "surface_id": "human-ui",
      "checks": [
        {
          "actual": "draft",
          "passed": true,
          "requirement_id": "order.is_draft"
        },
        {
          "actual": {
            "order_id": "ord_100245",
            "order_total": "$177.00",
            "payment_method": "Visa ending 4242"
          },
          "passed": true,
          "requirement_id": "checkout.exact_scope"
        },
        {
          "actual": "authorization_denied",
          "passed": true,
          "requirement_id": "authorization.denied"
        },
        {
          "actual": {
            "order_id": "ord_100245",
            "order_status": "draft",
            "payment_status": "unpaid"
          },
          "passed": true,
          "requirement_id": "order.unchanged"
        },
        {
          "actual": false,
          "passed": false,
          "requirement_id": "authorization.allowed"
        },
        {
          "actual": "not_reached",
          "passed": false,
          "requirement_id": "confirmation.accepted"
        },
        {
          "actual": "not_reached",
          "passed": false,
          "requirement_id": "confirmation.declined"
        },
        {
          "actual": 0,
          "passed": false,
          "requirement_id": "payment.idempotent"
        },
        {
          "actual": "authorization_denied",
          "passed": false,
          "requirement_id": "execution.failure_isolated"
        },
        {
          "actual": 0,
          "passed": false,
          "requirement_id": "payment.charge"
        },
        {
          "actual": "draft",
          "passed": false,
          "requirement_id": "order.submitted"
        },
        {
          "actual": "unpaid",
          "passed": false,
          "requirement_id": "payment.charged"
        },
        {
          "actual": 0,
          "passed": false,
          "requirement_id": "checkout.audit_recorded"
        },
        {
          "actual": false,
          "passed": false,
          "requirement_id": "checkout.safe_recovery"
        }
      ],
      "confirmation": "not_reached",
      "error_code": "authorization_denied",
      "outcome": {
        "order_id": "ord_100245",
        "order_status": "draft",
        "payment_status": "unpaid"
      },